{
  "record_kind": "drowned_harbor_presentation_family_registration",
  "record_version": 1,
  "identity": {
    "release_id": "DH-PRESENT-REG-002",
    "family_id": "DH-PRESENT-FAMILY-001",
    "governing_issue": 118,
    "visual_baseline_id": "DH-VBL-001",
    "conversion_brief_id": "DH-VCB-001",
    "registered_predecessor": {
      "release_id": "DH-PRESENT-REG-001",
      "study_id": "DH-PRESENT-001",
      "issue": 114,
      "pr": 115,
      "merge_sha": "671b8f2512be80c0c5f2cec701c29445159620e2"
    },
    "study_ids": [
      "DH-PRESENT-002",
      "DH-PRESENT-003"
    ],
    "review_disposition": "accepted_external_storyboard_references_with_qualifications"
  },
  "release": {
    "protected_main_base": "42e2fed1737fa17bad5d2bafb6dee6aedad87319",
    "branch": "docs/dh-present-002-003-family-registration",
    "planning_only": true,
    "metadata_only": true,
    "combined_registration": true,
    "separate_releases_required": false
  },
  "authorization": {
    "implementation_authorized": false,
    "ux_implementation_authorized": false,
    "codex_authorized": false,
    "production_art_authorized": false,
    "candidate_creation_authorized": false,
    "candidate_promotion_authorized": false,
    "runtime_paths_authorized": false,
    "source_art_paths_authorized": false,
    "image_binaries_authorized": false,
    "public_distribution_authorized": false,
    "normal_tale_registration_authorized": false,
    "ordinary_export_inclusion_authorized": false,
    "conversion_ready": false,
    "pr_32_incorporated": false
  },
  "external_package": {
    "filename": "DH-PRESENT-002-003_External_Art_Director_Planning_Package_v1.zip",
    "bytes": 5313560,
    "sha256": "5f9c5c9a965bb58b99e8771d8e2448f1bf7c1a3e4f0c1b300b52812208aeee4b",
    "repository_disposition": "external_private_only",
    "integrity_verified": true,
    "manifest": {
      "path": "02_MACHINE_READABLE/PACKAGE_MANIFEST.json",
      "bytes": 1972,
      "sha256": "640110e50a85a6dc9a146b2cd9212c77a351f964f4a8e64a58ac5ce0af5d438c",
      "file_count_excluding_manifest": 8,
      "all_payloads_matched": true
    },
    "payloads": [
      {
        "path": "00_START_HERE/README_FIRST.md",
        "bytes": 984,
        "sha256": "808aa9102ae9db025864b08bf5b3bdd19a299976fa983d21f1498851c8690832"
      },
      {
        "path": "01_STUDIES/DH-PRESENT-002-003_Narrative_Planning_Record_v1.md",
        "bytes": 3878,
        "sha256": "aecbe9ae48baab34152eb5214e572783e3e653c00288b49a42b17f56d5e37564"
      },
      {
        "path": "01_STUDIES/DH-PRESENT-002_Drowned_Harbor_Last_Light_Environmental_Presentation-Hook_Storyboard_Study_v1.png",
        "bytes": 2809928,
        "sha256": "904aa44dfa2b6980d88d0776213d28d3e1fa3b2b8acba7798fdbed84e526e00e"
      },
      {
        "path": "01_STUDIES/DH-PRESENT-003_Drowned_Harbor_Ending_Resolution_and_Epilogue_Attribution_Presentation-Hook_Storyboard_Study_v1.png",
        "bytes": 2580384,
        "sha256": "dc8cd6ee426c486043a688bcf3a89025597e2c96b2b66e4064392b9bd9f901b2"
      },
      {
        "path": "02_MACHINE_READABLE/DH-PRESENT-002-003_Study_Register_v1.json",
        "bytes": 4703,
        "sha256": "c607a4ddd6199c3f65030b0c42bbf47df1384816a56fe5bd56b8459babff6439"
      },
      {
        "path": "03_PROVENANCE_AND_RIGHTS/DH-PRESENT-002-003_Provenance_and_Rights_Record_v1.json",
        "bytes": 1244,
        "sha256": "2a81451af3d7df94c831ce3f5db51e5979d5b90e73d9c83994fa918eb42b120c"
      },
      {
        "path": "03_PROVENANCE_AND_RIGHTS/UNRESOLVED_FACTS_AND_RIGHTS.md",
        "bytes": 746,
        "sha256": "35cc5876edd78be74a7f3194ae56ac40374c813cd1bf3851120b701071fbb533"
      },
      {
        "path": "04_RELEASE_COORDINATOR/SEND_AFTER_ISSUE_116_COMPLETES.md",
        "bytes": 1555,
        "sha256": "46d6414f97484315343bfd4ef4b610f2da70188a203609126e07407a63d86d98"
      }
    ]
  },
  "studies": [
    {
      "study_id": "DH-PRESENT-002",
      "title": "Drowned Harbor Last Light Environmental Presentation-Hook Storyboard Study v1",
      "review_disposition": "accepted_external_storyboard_reference_with_qualifications",
      "image": {
        "filename": "DH-PRESENT-002_Drowned_Harbor_Last_Light_Environmental_Presentation-Hook_Storyboard_Study_v1.png",
        "media_type": "image/png",
        "width_px": 1672,
        "height_px": 941,
        "mode": "RGB",
        "bytes": 2809928,
        "sha256": "904aa44dfa2b6980d88d0776213d28d3e1fa3b2b8acba7798fdbed84e526e00e",
        "decode_verified": true,
        "embedded_metadata_detected": false,
        "repository_path": null,
        "repository_disposition": "external_private_only",
        "runtime_composition": false,
        "logical_960x540_validation": false
      },
      "generation": {
        "generator_context": "OpenAI ChatGPT image generation in the Terror Turn Art Director specialist chat",
        "available_generation_id": "34e1383c-a055-42fb-8458-f9c5e1a28642",
        "exact_model_variant": null,
        "exact_prompt": null,
        "exact_negative_prompt": null,
        "seed": null,
        "exact_generation_timestamp": null,
        "generator_side_reference_handling": null,
        "human_edits_after_generation": "none_known_not_proof_none_occurred",
        "content_credentials_status": null,
        "watermark_status": null
      },
      "frames": [
        {
          "frame_id": "DH-PRESENT-002-FR-01",
          "title": "Settled High Water / Last Light Entry"
        },
        {
          "frame_id": "DH-PRESENT-002-FR-02",
          "title": "Lighthouse Call"
        },
        {
          "frame_id": "DH-PRESENT-002-FR-03",
          "title": "Final-Route Emphasis"
        },
        {
          "frame_id": "DH-PRESENT-002-FR-04",
          "title": "Public Commitment Gathering"
        },
        {
          "frame_id": "DH-PRESENT-002-FR-05",
          "title": "Mechanism Readiness"
        },
        {
          "frame_id": "DH-PRESENT-002-FR-06",
          "title": "Commitment Preview — Reversible"
        },
        {
          "frame_id": "DH-PRESENT-002-FR-07",
          "title": "Confirmed Commitment Boundary"
        },
        {
          "frame_id": "DH-PRESENT-002-FR-08",
          "title": "Environmental Response"
        },
        {
          "frame_id": "DH-PRESENT-002-FR-09",
          "title": "Exact Committed Last Light State"
        },
        {
          "frame_id": "DH-PRESENT-002-FR-10",
          "title": "Skip / Interruption / Replay Equivalence"
        }
      ],
      "stage": "last_light_v1",
      "authority_owner": "rules_session",
      "special_qualification": "DH-PRESENT-002-FR-06 visualizes only an already-authorized public-safe reversible pre-commit state; it creates no legal action, predictive simulation, hidden-desirability disclosure, or ending preview authority.",
      "lifecycle": {
        "status": "generated_external",
        "review_status": "accepted_external_storyboard_reference_with_qualifications",
        "candidate_id": null,
        "production_candidate": false,
        "approved": false
      }
    },
    {
      "study_id": "DH-PRESENT-003",
      "title": "Drowned Harbor Ending Resolution and Epilogue Attribution Presentation-Hook Storyboard Study v1",
      "review_disposition": "accepted_external_storyboard_reference_with_qualifications",
      "image": {
        "filename": "DH-PRESENT-003_Drowned_Harbor_Ending_Resolution_and_Epilogue_Attribution_Presentation-Hook_Storyboard_Study_v1.png",
        "media_type": "image/png",
        "width_px": 1536,
        "height_px": 1024,
        "mode": "RGB",
        "bytes": 2580384,
        "sha256": "dc8cd6ee426c486043a688bcf3a89025597e2c96b2b66e4064392b9bd9f901b2",
        "decode_verified": true,
        "embedded_metadata_detected": false,
        "repository_path": null,
        "repository_disposition": "external_private_only",
        "runtime_composition": false,
        "logical_960x540_validation": false
      },
      "generation": {
        "generator_context": "OpenAI ChatGPT image generation in the Terror Turn Art Director specialist chat",
        "available_generation_id": "bce19b7c-3393-477c-9724-9553145f343a",
        "exact_model_variant": null,
        "exact_prompt": null,
        "exact_negative_prompt": null,
        "seed": null,
        "exact_generation_timestamp": null,
        "generator_side_reference_handling": null,
        "human_edits_after_generation": "none_known_not_proof_none_occurred",
        "content_credentials_status": null,
        "watermark_status": null
      },
      "frames": [
        {
          "frame_id": "DH-PRESENT-003-FR-01",
          "title": "Committed Last Light Baseline"
        },
        {
          "frame_id": "DH-PRESENT-003-FR-02",
          "title": "Resolution Begins"
        },
        {
          "frame_id": "DH-PRESENT-003-FR-03",
          "title": "Public Ending Result"
        },
        {
          "frame_id": "DH-PRESENT-003-FR-04",
          "title": "Landmark Aftermath"
        },
        {
          "frame_id": "DH-PRESENT-003-FR-05",
          "title": "Stable-Seat Public Outcome Rail"
        },
        {
          "frame_id": "DH-PRESENT-003-FR-06",
          "title": "Private-Safe Attribution Boundary"
        },
        {
          "frame_id": "DH-PRESENT-003-FR-07",
          "title": "Public Epilogue Begins"
        },
        {
          "frame_id": "DH-PRESENT-003-FR-08",
          "title": "Consequence Montage"
        },
        {
          "frame_id": "DH-PRESENT-003-FR-09",
          "title": "Acknowledgment and Replay"
        },
        {
          "frame_id": "DH-PRESENT-003-FR-10",
          "title": "Cleanup Handoff"
        }
      ],
      "stages": [
        "ending_resolution_v1",
        "epilogue_attribution_v1",
        "rematch_title_cleanup_v1"
      ],
      "authority_owners": {
        "ending_resolution": "rules_session",
        "private_attribution": "role_session",